{
  "schema_version": 2,
  "run_id": "example-run",
  "recorded_at": "2000-01-01T00:00:00Z",
  "manifest_sha256": "replace-with-generated-sha256",
  "checks": {
    "self_test": {"verdict": "PASS", "command": "node scripts/self-test.mjs", "exit_code": 0, "stdout_sha256": "replace-with-generated-sha256", "stderr_sha256": "replace-with-generated-sha256"},
    "synthetic_smoke": {"verdict": "PASS", "command": "node scripts/smoke-dashboard.mjs", "exit_code": 0, "stdout_sha256": "replace-with-generated-sha256", "stderr_sha256": "replace-with-generated-sha256"},
    "reproducibility": {"verdict": "PASS", "command": "node scripts/build-census.mjs --run-dir <replay>", "exit_code": 0, "stdout_sha256": "replace-with-generated-sha256", "stderr_sha256": "replace-with-generated-sha256", "identities_equal": true, "manifest_counts_equal": true, "identity_sha256": "replace-with-generated-sha256"},
    "browser": {
      "verdict": "PASS",
      "environment": {"os": "recorded by record-qa.mjs", "node": "recorded", "browser": "recorded", "transport": "local HTTP"},
      "desktop": {"total_count": 0, "load_ms": 0, "screenshot": "qa/desktop.png", "screenshot_sha256": "replace-with-generated-sha256"},
      "candidate_filter": {"total_count": 0, "repaint_ms": 0},
      "mobile": {"viewport_width": 390, "document_scroll_width": 390, "document_client_width": 390, "screenshot": "qa/mobile.png", "screenshot_sha256": "replace-with-generated-sha256"},
      "accessibility": {"h1": 1, "skip_link": true, "unlabeled_controls": 0},
      "console_errors": []
    }
  }
}
